{"baseline":{"configuration_sha256":"47c0b40b2482b49648cd47cc6f0711883a64150e4dd281b76eb8d9a58f9216e4","run_id":"candidate-screening-oracle-2026-r1:baseline","run_sha256":"68887ecbacf1989af32deedd3b5e04569231823164e60c662654ac55853b9875"},"bindings":{"compiler_artifact_sha256":"bc99a9d9db4495041ef7e0ed0e025959af691d8fea5fdf273695e7e905f1afb0","measurement_protocol_id":"rv64gc-qemu-fwcfg-v1-20260810","measurement_protocol_sha256":"00de39da36b1cf7e0fe5bd21545e4e5b01d800e03eaefbf33a7935f6eeb66548","pipeline_profile_id":"full","pipeline_profile_sha256":"9e7ae49f74aaf2fe57afe7b463821b4e346e736b2caf4e5f500b7453855e3efa","repo_commit":"a8b7f67cdca55d0a51cabac07262a8571360b688","repo_dirty":false,"tracked_diff_sha256":null},"candidate_evidence_sha256":"051d1ea2efeffb101fb0ace12491534b380696710cee503e0a36ce293eaee12c","candidates":[{"candidate_id":"bitset","oracle_family_id":"bitset","structures":[{"eligible_for_ranking":true,"geometric_mean_upper_bound":0.8313522116850329,"ineligibility_reason":null,"paired_datasets":3,"sizes":{"large":{"baseline_case_id":"rv64gc:oracle:bitset:boolean_and:large:baseline","baseline_metric_value":2253.0,"eligible_for_ranking":true,"family":"bitset","ineligibility_reason":null,"optimized_case_id":"rv64gc:oracle:bitset:boolean_and:large:optimized","optimized_metric_value":2720.0,"pair_id":"bitset:boolean_and:large","size":"large","speedup":0.8283088235294118,"structure_id":"boolean_and"},"medium":{"baseline_case_id":"rv64gc:oracle:bitset:boolean_and:medium:baseline","baseline_metric_value":1308.0,"eligible_for_ranking":true,"family":"bitset","ineligibility_reason":null,"optimized_case_id":"rv64gc:oracle:bitset:boolean_and:medium:optimized","optimized_metric_value":1579.0,"pair_id":"bitset:boolean_and:medium","size":"medium","speedup":0.8283723875870804,"structure_id":"boolean_and"},"small":{"baseline_case_id":"rv64gc:oracle:bitset:boolean_and:small:baseline","baseline_metric_value":685.0,"eligible_for_ranking":true,"family":"bitset","ineligibility_reason":null,"optimized_case_id":"rv64gc:oracle:bitset:boolean_and:small:optimized","optimized_metric_value":818.0,"pair_id":"bitset:boolean_and:small","size":"small","speedup":0.8374083129584352,"structure_id":"boolean_and"}},"structure_id":"boolean_and"},{"eligible_for_ranking":true,"geometric_mean_upper_bound":0.8305687053984715,"ineligibility_reason":null,"paired_datasets":3,"sizes":{"large":{"baseline_case_id":"rv64gc:oracle:bitset:boolean_or:large:baseline","baseline_metric_value":2347.0,"eligible_for_ranking":true,"family":"bitset","ineligibility_reason":null,"optimized_case_id":"rv64gc:oracle:bitset:boolean_or:large:optimized","optimized_metric_value":2832.0,"pair_id":"bitset:boolean_or:large","size":"large","speedup":0.8287429378531074,"structure_id":"boolean_or"},"medium":{"baseline_case_id":"rv64gc:oracle:bitset:boolean_or:medium:baseline","baseline_metric_value":1358.0,"eligible_for_ranking":true,"family":"bitset","ineligibility_reason":null,"optimized_case_id":"rv64gc:oracle:bitset:boolean_or:medium:optimized","optimized_metric_value":1633.0,"pair_id":"bitset:boolean_or:medium","size":"medium","speedup":0.8315982853643601,"structure_id":"boolean_or"},"small":{"baseline_case_id":"rv64gc:oracle:bitset:boolean_or:small:baseline","baseline_metric_value":705.0,"eligible_for_ranking":true,"family":"bitset","ineligibility_reason":null,"optimized_case_id":"rv64gc:oracle:bitset:boolean_or:small:optimized","optimized_metric_value":848.0,"pair_id":"bitset:boolean_or:small","size":"small","speedup":0.8313679245283019,"structure_id":"boolean_or"}},"structure_id":"boolean_or"},{"eligible_for_ranking":true,"geometric_mean_upper_bound":0.8033567009274484,"ineligibility_reason":null,"paired_datasets":3,"sizes":{"large":{"baseline_case_id":"rv64gc:oracle:bitset:boolean_xor:large:baseline","baseline_metric_value":2265.0,"eligible_for_ranking":true,"family":"bitset","ineligibility_reason":null,"optimized_case_id":"rv64gc:oracle:bitset:boolean_xor:large:optimized","optimized_metric_value":2837.0,"pair_id":"bitset:boolean_xor:large","size":"large","speedup":0.7983785689108213,"structure_id":"boolean_xor"},"medium":{"baseline_case_id":"rv64gc:oracle:bitset:boolean_xor:medium:baseline","baseline_metric_value":1328.0,"eligible_for_ranking":true,"family":"bitset","ineligibility_reason":null,"optimized_case_id":"rv64gc:oracle:bitset:boolean_xor:medium:optimized","optimized_metric_value":1656.0,"pair_id":"bitset:boolean_xor:medium","size":"medium","speedup":0.8019323671497585,"structure_id":"boolean_xor"},"small":{"baseline_case_id":"rv64gc:oracle:bitset:boolean_xor:small:baseline","baseline_metric_value":694.0,"eligible_for_ranking":true,"family":"bitset","ineligibility_reason":null,"optimized_case_id":"rv64gc:oracle:bitset:boolean_xor:small:optimized","optimized_metric_value":857.0,"pair_id":"bitset:boolean_xor:small","size":"small","speedup":0.809801633605601,"structure_id":"boolean_xor"}},"structure_id":"boolean_xor"}]},{"candidate_id":"boom_ilp","oracle_family_id":"boom_ilp","structures":[{"eligible_for_ranking":true,"geometric_mean_upper_bound":1.0051685540881232,"ineligibility_reason":null,"paired_datasets":3,"sizes":{"large":{"baseline_case_id":"rv64gc:oracle:boom_ilp:dot_unroll4:large:baseline","baseline_metric_value":606252.0,"eligible_for_ranking":true,"family":"boom_ilp","ineligibility_reason":null,"optimized_case_id":"rv64gc:oracle:boom_ilp:dot_unroll4:large:optimized","optimized_metric_value":602167.0,"pair_id":"boom_ilp:dot_unroll4:large","size":"large","speedup":1.0067838323920109,"structure_id":"dot_unroll4"},"medium":{"baseline_case_id":"rv64gc:oracle:boom_ilp:dot_unroll4:medium:baseline","baseline_metric_value":75820.0,"eligible_for_ranking":true,"family":"boom_ilp","ineligibility_reason":null,"optimized_case_id":"rv64gc:oracle:boom_ilp:dot_unroll4:medium:optimized","optimized_metric_value":75319.0,"pair_id":"boom_ilp:dot_unroll4:medium","size":"medium","speedup":1.0066517080683492,"structure_id":"dot_unroll4"},"small":{"baseline_case_id":"rv64gc:oracle:boom_ilp:dot_unroll4:small:baseline","baseline_metric_value":2412.0,"eligible_for_ranking":true,"family":"boom_ilp","ineligibility_reason":null,"optimized_case_id":"rv64gc:oracle:boom_ilp:dot_unroll4:small:optimized","optimized_metric_value":2407.0,"pair_id":"boom_ilp:dot_unroll4:small","size":"small","speedup":1.0020772746157043,"structure_id":"dot_unroll4"}},"structure_id":"dot_unroll4"},{"eligible_for_ranking":true,"geometric_mean_upper_bound":1.2133097639654558,"ineligibility_reason":null,"paired_datasets":3,"sizes":{"large":{"baseline_case_id":"rv64gc:oracle:boom_ilp:independent_chains:large:baseline","baseline_metric_value":835660.0,"eligible_for_ranking":true,"family":"boom_ilp","ineligibility_reason":null,"optimized_case_id":"rv64gc:oracle:boom_ilp:independent_chains:large:optimized","optimized_metric_value":688197.0,"pair_id":"boom_ilp:independent_chains:large","size":"large","speedup":1.2142744010799233,"structure_id":"independent_chains"},"medium":{"baseline_case_id":"rv64gc:oracle:boom_ilp:independent_chains:medium:baseline","baseline_metric_value":104524.0,"eligible_for_ranking":true,"family":"boom_ilp","ineligibility_reason":null,"optimized_case_id":"rv64gc:oracle:boom_ilp:independent_chains:medium:optimized","optimized_metric_value":86085.0,"pair_id":"boom_ilp:independent_chains:medium","size":"medium","speedup":1.2141952721147702,"structure_id":"independent_chains"},"small":{"baseline_case_id":"rv64gc:oracle:boom_ilp:independent_chains:small:baseline","baseline_metric_value":3340.0,"eligible_for_ranking":true,"family":"boom_ilp","ineligibility_reason":null,"optimized_case_id":"rv64gc:oracle:boom_ilp:independent_chains:small:optimized","optimized_metric_value":2757.0,"pair_id":"boom_ilp:independent_chains:small","size":"small","speedup":1.2114617337685891,"structure_id":"independent_chains"}},"structure_id":"independent_chains"},{"eligible_for_ranking":true,"geometric_mean_upper_bound":1.0056193276791054,"ineligibility_reason":null,"paired_datasets":3,"sizes":{"large":{"baseline_case_id":"rv64gc:oracle:boom_ilp:reduction_multi_acc:large:baseline","baseline_metric_value":573479.0,"eligible_for_ranking":true,"family":"boom_ilp","ineligibility_reason":null,"optimized_case_id":"rv64gc:oracle:boom_ilp:reduction_multi_acc:large:optimized","optimized_metric_value":569393.0,"pair_id":"boom_ilp:reduction_multi_acc:large","size":"large","speedup":1.007176062930173,"structure_id":"reduction_multi_acc"},"medium":{"baseline_case_id":"rv64gc:oracle:boom_ilp:reduction_multi_acc:medium:baseline","baseline_metric_value":71719.0,"eligible_for_ranking":true,"family":"boom_ilp","ineligibility_reason":null,"optimized_case_id":"rv64gc:oracle:boom_ilp:reduction_multi_acc:medium:optimized","optimized_metric_value":71217.0,"pair_id":"boom_ilp:reduction_multi_acc:medium","size":"medium","speedup":1.0070488787789433,"structure_id":"reduction_multi_acc"},"small":{"baseline_case_id":"rv64gc:oracle:boom_ilp:reduction_multi_acc:small:baseline","baseline_metric_value":2279.0,"eligible_for_ranking":true,"family":"boom_ilp","ineligibility_reason":null,"optimized_case_id":"rv64gc:oracle:boom_ilp:reduction_multi_acc:small:optimized","optimized_metric_value":2273.0,"pair_id":"boom_ilp:reduction_multi_acc:small","size":"small","speedup":1.0026396832380113,"structure_id":"reduction_multi_acc"}},"structure_id":"reduction_multi_acc"}]},{"candidate_id":"closed_form","oracle_family_id":"closed_form","structures":[{"eligible_for_ranking":true,"geometric_mean_upper_bound":20.687536748936612,"ineligibility_reason":null,"paired_datasets":3,"sizes":{"large":{"baseline_case_id":"rv64gc:oracle:closed_form:linear_sum:large:baseline","baseline_metric_value":4817.0,"eligible_for_ranking":true,"family":"closed_form","ineligibility_reason":null,"optimized_case_id":"rv64gc:oracle:closed_form:linear_sum:large:optimized","optimized_metric_value":26.0,"pair_id":"closed_form:linear_sum:large","size":"large","speedup":185.26923076923077